{
  "name": "cowork-working-smoke",
  "datasets": [{ "type": "file", "path": "configs/cowork-smoke.cases.json" }],
  "host": {
    "type": "cowork",
    "model": "claude-opus-4-6",
    "provider": "anthropic",
    "timeout": 300000,
    "options": {
      "computerUseProvider": "anthropic-computer-use",
      "computerUseModel": "claude-sonnet-4-6"
    }
  },
  "servers": [],
  "concurrency": 1,
  "iterations": 1
}
